{"byte_length":3007,"event_ref":"contracts/fixtures/governance-models/valid/g0-policy-ratification.json","event_sha256":"d2500565522714fc5de1ee77fa4b75d1a76f1c7382e0c5f4a412e02553b70508","observed_event_sha256":"d2500565522714fc5de1ee77fa4b75d1a76f1c7382e0c5f4a412e02553b70508","publication_receipt_ref":"contracts/fixtures/governance-models/valid/g0-policy-ratification-publication-receipt.json","publication_receipt_sha256":"5445cc4d3046fe70682449b76b225ffa6aca0d38029ab4b8d15a05e6b90f17b8","read_back_at":"2026-06-01T12:02:05Z","readback_authority_ref":"contracts/fixtures/governance-models/valid/g0-operation-authority-event-readback.json","readback_authority_sha256":"7bc24c04b6f9f3d12fd9eeb61eb5d9834574a60af4562d7cb8ee34246a64b4ec","reader_id":"fixture-g0-event-reader","receipt_id":"fixture-g0-policy-ratification-readback-receipt","receipt_issuer_id":"fixture-g0-terminal-receipt-issuer","repository_locator":"fixture://canonical-governance-subject/repository/r1","result":"MATCH","schema":"ylx.g0-policy-ratification-readback-receipt.v1","signature":"7RWsJHrSAl4MIH96PccIlRrLtt8e86Uw7qLTAWseIJsuPaFjLhBCbf0Z/Pz42LIHlKGP7g4RaDFqKPzv2yCyBA==","signature_algorithm":"Ed25519","signed_payload_sha256":"cc7adf5e59c0584bbe5eeb77d94abd5bf59cb5ffa27ced934568ed0a959ec5bb","signing_key_id":"fixture-g0-terminal-receipt-issuer-key","target_scope":"contracts/fixtures/governance-models/valid/g0-policy-ratification.json","terminal_sink_id":"fixture-g0-terminal-audit-sink"}